{
  "$schema": "../schema/ui-ground-truth.schema.json",
  "schemaVersion": 1,
  "truthId": "task-settings-167.workshop-left-pages.strength",
  "status": "verified",
  "scope": {
    "taskId": "TASK-SETTINGS-167",
    "surfaceId": "workshop-character-198-strength",
    "originalVersion": "RegiMA 1.1 restored corpus",
    "description": "强化页 character 198 静态显示列表、原生文字字段、槽位容器、提交按钮与舞台几何。运行时 ShowObj 子项和全局 toast 由 AS3 状态矩阵补充，不伪装成 SWF 静态帧。"
  },
  "generatedBy": {
    "tool": "generate-workshop-left-ground-truth.mjs",
    "toolVersion": "1",
    "command": "npm run generate:workshop-left-truth",
    "generatedAt": "2026-08-09T18:00:00+08:00"
  },
  "provenance": [
    {
      "id": "backpack1-swf",
      "sourceType": "restored-swf",
      "sourcePath": "local-resources/regima/source/restored-swfs/assets/backpack1.swf",
      "sha256": "70c1f1b535ea789ad9c77556f90c7c107084278a4d1773e31471f2b4d7454936",
      "locator": "character 198 export.strength.Strength; root character 119 at 24fps, 940x590."
    },
    {
      "id": "backpack1-xml",
      "sourceType": "ffdec-xml",
      "sourcePath": "local-resources/regima/task-outputs/task-settings-165b-backpack-review/backpack1.xml",
      "sha256": "7d98f09d0921778bd775ac0199e921c99796c2cab4dbe75aac6898984c046d7c",
      "locator": "DefineSprite characterID=198, frame 1 PlaceObject depth/matrix/instanceName; button records 185."
    },
    {
      "id": "strength-as3",
      "sourceType": "legacy-as3",
      "sourcePath": "local-resources/regima/legacy-extraction/resources_by_swf/[172845].swf/scripts/export/strength/Strength.as",
      "sha256": "e10f676f99d5c713aab9b109c56e54367f4e91e73283b40ff8f6ea9b4591282d",
      "locator": "export.strength.Strength: constructor, show/change/submit handlers, dynamic ShowObj children and feedback routing."
    },
    {
      "id": "strength-equipment-as",
      "sourceType": "legacy-as3",
      "sourcePath": "local-resources/regima/legacy-extraction/resources_by_swf/[172845].swf/scripts/export/strength/StrengthEquipment.as",
      "sha256": "0621259b3220a0693bf414de3b34107bea03a68d13a10b4cd0c09a929ebff28b",
      "locator": "StrengthEquipment page creation and root placements; export.strength.Strength selection."
    }
  ],
  "stage": {
    "width": 940,
    "height": 590,
    "frameRate": 24,
    "coordinateSpace": "stage",
    "scaleMode": "noScale",
    "alignment": "top-left"
  },
  "states": [
    {
      "id": "strength-static-skeleton",
      "entry": "MapMenu -> GMain.showStrengthEquip -> StrengthEquipment -> export.strength.Strength",
      "frame": 1,
      "fixtureId": "original-static-skeleton; runtime dynamic children covered by AS3 state matrix",
      "baselineId": "original-strength-940x590"
    }
  ],
  "displayObjects": [
    {
      "id": "strength-page-root",
      "parentId": null,
      "depth": 0,
      "objectType": "movie-clip",
      "sourceIdentity": {
        "provenanceId": "backpack1-swf",
        "characterId": 198,
        "symbolClass": "export.strength.Strength",
        "instanceName": "strength",
        "frame": 1
      },
      "placements": [
        {
          "stateId": "strength-static-skeleton",
          "visible": true,
          "localMatrix": {
            "a": 1,
            "b": 0,
            "c": 0,
            "d": 1,
            "tx": 175.6,
            "ty": 128.45
          },
          "registrationPoint": {
            "x": 0,
            "y": 0
          },
          "localBounds": {
            "left": -49,
            "top": 5,
            "width": 369.95,
            "height": 350.95
          },
          "stageBounds": {
            "left": 126.6,
            "top": 133.45,
            "width": 369.95,
            "height": 350.95
          },
          "derivation": "calculated",
          "derivationMethod": "StrengthEquipment.as root placement composed with the FFDec SVG normalization matrix and exported visible envelope.",
          "evidenceRefs": [
            "strength-equipment-as:page-placement",
            "page-svg:198"
          ]
        }
      ],
      "render": {
        "assetRef": "local-resources/regima/task-outputs/task-settings-167-workshop-left-pages/sprites-svg/DefineSprite_198_export.strength.Strength/1.svg",
        "blendMode": "normal",
        "filters": [],
        "maskId": null
      }
    },
    {
      "id": "shape-178-depth-2",
      "parentId": "strength-page-root",
      "depth": 2,
      "objectType": "shape",
      "sourceIdentity": {
        "provenanceId": "backpack1-xml",
        "characterId": 178,
        "symbolClass": null,
        "instanceName": null,
        "frame": 1
      },
      "placements": [
        {
          "stateId": "strength-static-skeleton",
          "visible": true,
          "localMatrix": {
            "a": 1,
            "b": 0,
            "c": 0,
            "d": 1,
            "tx": 0,
            "ty": 0
          },
          "registrationPoint": {
            "x": 0,
            "y": 0
          },
          "localBounds": {
            "left": 0,
            "top": 0,
            "width": 247.55,
            "height": 30.4
          },
          "stageBounds": {
            "left": 175.6,
            "top": 128.45,
            "width": 247.55,
            "height": 30.4
          },
          "derivation": "extracted",
          "derivationMethod": "Root-frame PlaceObject order/matrix and FFDec SVG reported envelope; dynamic child contents are intentionally not promoted to static frame objects.",
          "evidenceRefs": [
            "backpack1-xml:character-198-depth-2",
            "page-svg:198"
          ]
        }
      ],
      "render": {
        "assetRef": "local-resources/regima/task-outputs/task-settings-167-workshop-left-pages/sprites-svg/DefineSprite_198_export.strength.Strength/1.svg#shape0",
        "blendMode": "normal",
        "filters": [],
        "maskId": null
      }
    },
    {
      "id": "txt_needlh",
      "parentId": "strength-page-root",
      "depth": 3,
      "objectType": "text-field",
      "sourceIdentity": {
        "provenanceId": "backpack1-xml",
        "characterId": 179,
        "symbolClass": null,
        "instanceName": "txt_needlh",
        "frame": 1
      },
      "placements": [
        {
          "stateId": "strength-static-skeleton",
          "visible": true,
          "localMatrix": {
            "a": 1,
            "b": 0,
            "c": 0,
            "d": 1,
            "tx": 86,
            "ty": 270
          },
          "registrationPoint": {
            "x": 0,
            "y": 0
          },
          "localBounds": {
            "left": 0,
            "top": 0,
            "width": 101,
            "height": 22.05
          },
          "stageBounds": {
            "left": 261.6,
            "top": 398.45,
            "width": 101,
            "height": 22.05
          },
          "derivation": "extracted",
          "derivationMethod": "Root-frame PlaceObject order/matrix and FFDec SVG reported envelope; dynamic child contents are intentionally not promoted to static frame objects.",
          "evidenceRefs": [
            "backpack1-xml:character-198-depth-3",
            "page-svg:198"
          ]
        }
      ],
      "render": {
        "assetRef": "local-resources/regima/task-outputs/task-settings-167-workshop-left-pages/sprites-svg/DefineSprite_198_export.strength.Strength/1.svg#text0",
        "blendMode": "normal",
        "filters": [],
        "maskId": null,
        "textStyle": {
          "fontFamily": "FZCuYuan-M03",
          "fontSize": 15,
          "color": "#ffffff",
          "leading": 2,
          "dynamic": "txt_needlh"
        }
      }
    },
    {
      "id": "txt_success",
      "parentId": "strength-page-root",
      "depth": 4,
      "objectType": "text-field",
      "sourceIdentity": {
        "provenanceId": "backpack1-xml",
        "characterId": 180,
        "symbolClass": null,
        "instanceName": "txt_success",
        "frame": 1
      },
      "placements": [
        {
          "stateId": "strength-static-skeleton",
          "visible": true,
          "localMatrix": {
            "a": 1,
            "b": 0,
            "c": 0,
            "d": 1,
            "tx": 250.55,
            "ty": 270.05
          },
          "registrationPoint": {
            "x": 0,
            "y": 0
          },
          "localBounds": {
            "left": 0,
            "top": 0,
            "width": 72.4,
            "height": 22.05
          },
          "stageBounds": {
            "left": 426.15,
            "top": 398.5,
            "width": 72.4,
            "height": 22.05
          },
          "derivation": "extracted",
          "derivationMethod": "Root-frame PlaceObject order/matrix and FFDec SVG reported envelope; dynamic child contents are intentionally not promoted to static frame objects.",
          "evidenceRefs": [
            "backpack1-xml:character-198-depth-4",
            "page-svg:198"
          ]
        }
      ],
      "render": {
        "assetRef": "local-resources/regima/task-outputs/task-settings-167-workshop-left-pages/sprites-svg/DefineSprite_198_export.strength.Strength/1.svg#text1",
        "blendMode": "normal",
        "filters": [],
        "maskId": null,
        "textStyle": {
          "fontFamily": "FZCuYuan-M03",
          "fontSize": 15,
          "color": "#ffffff",
          "leading": 2,
          "dynamic": "txt_success"
        }
      }
    },
    {
      "id": "shape-159-depth-5",
      "parentId": "strength-page-root",
      "depth": 5,
      "objectType": "shape",
      "sourceIdentity": {
        "provenanceId": "backpack1-xml",
        "characterId": 159,
        "symbolClass": null,
        "instanceName": null,
        "frame": 1
      },
      "placements": [
        {
          "stateId": "strength-static-skeleton",
          "visible": true,
          "localMatrix": {
            "a": 1,
            "b": 0,
            "c": 0,